program,description,example_grantees,year_named,notes
Higher Learning,Investment in colleges and universities; explicit emphasis on minority-serving institutions (HBCUs, tribal colleges, HSIs); fellowships and faculty support,Mellon Mays Undergraduate Fellowship recipients; CSU Fresno; CCNY; Old Dominion; UMKC; UNC Greensboro,2020,Successor to historic Higher Education & Scholarship in the Humanities program
Arts and Culture,Performing arts, visual arts, museum support; emphasis on artist-centred organizations and racial-justice priorities,Whitney Museum; Smithsonian; Studio Museum in Harlem; Eyebeam,2020,
Public Knowledge,Libraries archives scholarly communications digital preservation,Internet Archive; ITHAKA/JSTOR; HathiTrust; Rhizome (Webrecorder); DPLA,2020,Home program for digital preservation funding
Humanities in Place,Place-specific cultural and humanities work; public history; historic-site reinterpretation; oral history; regional storytelling,Frontera Culture Fund recipients; place-based community archives,2020,New as a named area in 2020
Presidential Initiatives,Signature programs from the President's office; cross-cutting flagship commitments,Monuments Project; Creatives Rebuild New York; Affirming Multivocal Humanities; Writing Freedom Fellowship,2020,Used as home for cross-cutting flagships; Eyebeam GOS sits here too
